date,period_label,period,name,autor,comment,category,theme,wiki
490,Vème siècle av-jc,4,bataille de Marathon,,contre les Perses de Darius,,"[""histoire grecque""]",
480,Vème siècle av-jc,4,bataille de Salamine et des Thermopyles,,contre les Perses de Xerxès,,"[""histoire grecque""]",
477,Vème siècle av-jc,4,création de la ligue de Délos,,,,"[""histoire grecque""]",
1974,XXème siècle,28,"Anarchie, état et utopie",Nozick,,PH,,"https://www.wikiwand.com/fr/Anarchie,_%C3%89tat_et_utopie"
1991,XXème siècle,28,création du Web par Tim Berners-Lee,,"page infos, lien hypertexte, base HTML",,,https://www.wikiwand.com/fr/World_Wide_Web
2012,XXIème siècle,29,Expérimentation du Boson de Higgs,,,SC,,wikiwand.com/fr/Boson_de_Higgs